1,1,保育園,nursery,施設形態が保育園です,sk_,1,02,1,幼稚園,kindergarten,施設形態が幼稚園です,sk_,2,03,1,学童,schoolchild,施設形態が学童です,sk_,3,04,1,事業所内保育所,in_office,施設形態が事業所内保育所です,sk_,4,05,1,院内保育,hospital,施設形態が院内保育です,sk_,5,06,1,こども園,child_garden,施設形態がこども園です,sk_,6,07,1,病後児保育室,sick_child_care,施設形態が病後児保育室です,sk_,7,08,1,子育てひろば,openspace,施設形態が子育てひろばです,sk_,8,09,1,託児所,daycare,施設形態が託児所です,sk_,9,010,1,ベビーホテル,hotel,施設形態がベビーホテルです,sk_,10,011,1,イベント,event,施設形態がイベントです,sk_,11,012,2,保育士,childcare,職種が保育士です,ss_,1,013,2,幼稚園教諭,teacher,職種が幼稚園教諭です,ss_,2,014,2,栄養士,dietician,職種が栄養士です,ss_,3,015,2,調理師,cook,職種が調理師です,ss_,4,016,2,看護師,nurse,職種が看護師です,ss_,5,017,2,学童,schoolchild,職種が学童です,ss_,6,018,2,その他,others,職種がその他です,ss_,7,019,3,正社員,fulltime,雇用形態が正社員です,ko_,1,020,3,パート・アルバイト,parttime,雇用形態がパート・アルバイトです,ko_,2,021,3,契約社員,temp,雇用形態が契約社員です,ko_,3,022,3,派遣,dispatch,雇用形態が派遣です,ko_,4,023,3,紹介予定派遣,dispatch,雇用形態が紹介予定派遣です,ko_,5,024,4,保育士,childcare,資格が保育士です,l_,1,025,4,幼稚園教諭Ⅰ種,teacher_i,資格が幼稚園教諭Ⅰ種です,l_,2,026,4,幼稚園教諭Ⅱ種,teacher_ii,資格が幼稚園教諭Ⅱ種です,l_,3,027,4,管理栄養士,admin_dietitian,資格が管理栄養士です,l_,4,028,4,栄養士,dietician,資格が栄養士です,l_,5,029,4,調理師,cook,資格が調理師です,l_,6,030,4,看護師,nurse,資格が看護師です,l_,7,031,4,准看護師,associate,資格が准看護師です,l_,8,032,4,チャイルドマインダー,childminder,資格がチャイルドマインダーです,l_,9,033,4,ベビーシッター,sitter,資格がベビーシッターです,l_,10,034,4,無資格,unqualified,資格が無資格です,l_,11,035,5,寮・社宅あり,dormitory,求人こだわり条件が寮・社宅ありです,kk_,1,036,5,住宅手当あり,housing_allowance,求人こだわり条件が住宅手当ありです,kk_,2,037,5,退職金制度あり,retirement_allowance,求人こだわり条件が退職金制度ありです,kk_,3,038,5,交通費支給,carfare,求人こだわり条件が交通費支給です,kk_,4,039,5,社会保険完備,insurance,求人こだわり条件が社会保険完備です,kk_,5,040,5,育休・産休あり,maternity_leave,求人こだわり条件が育休・産休ありです,kk_,6,041,5,研修充実,training,求人こだわり条件が研修充実です,kk_,7,042,5,夜勤手当あり,nightwork_allowance,求人こだわり条件が夜勤手当ありです,kk_,8,043,5,引越し支援あり,moving,求人こだわり条件が引越し支援ありです,kk_,9,044,5,新卒求人,fresh,求人こだわり条件が新卒求人です,kk_,10,045,5,オープニング求人,opening,求人こだわり条件がオープニング求人です,kk_,11,046,5,園長求人,principal,求人こだわり条件が園長求人です,kk_,12,047,5,主任求人,manager,求人こだわり条件が主任求人です,kk_,13,048,5,経験者歓迎,experience,求人こだわり条件が経験者歓迎です,kk_,14,049,5,未経験者歓迎,non_experience,求人こだわり条件が未経験者歓迎です,kk_,15,050,5,ブランク歓迎,blank_welcome,求人こだわり条件がブランク歓迎です,kk_,16,051,5,英語話せる人歓迎,english,求人こだわり条件が英語話せる人歓迎です,kk_,17,052,5,年齢不問,any_age,求人こだわり条件が年齢不問です,kk_,18,053,5,無資格ＯＫ,unqualified_ok,求人こだわり条件が無資格ＯＫです,kk_,19,054,5,車・バイク通勤ＯＫ,car_commute,求人こだわり条件が車・バイク通勤ＯＫです,kk_,20,055,5,服装・髪型自由,clothes,求人こだわり条件が服装・髪型自由です,kk_,21,056,5,残業なし（少なめ）,no_overtime,求人こだわり条件が残業なし（少なめ）です,kk_,22,057,5,土日祝休み,holiday,求人こだわり条件が土日祝休みです,kk_,23,058,5,土日祝のみＯＫ,only_holiday,求人こだわり条件が土日祝のみＯＫです,kk_,24,059,5,完全週休2日,2days_off,求人こだわり条件が完全週休2日です,kk_,25,060,5,週2～3勤務ＯＫ,half_week,求人こだわり条件が週2～3勤務ＯＫです,kk_,26,061,5,短時間勤務ＯＫ,short,求人こだわり条件が短時間勤務ＯＫです,kk_,27,062,5,固定時間勤務ＯＫ,fixtime,求人こだわり条件が固定時間勤務ＯＫです,kk_,28,063,5,遅番勤務,late,求人こだわり条件が遅番勤務です,kk_,29,064,5,早番勤務,first,求人こだわり条件が早番勤務です,kk_,30,065,5,ゴールデンタイム勤務：9-15時,golden_time,求人こだわり条件がゴールデンタイム勤務：9-15時です,kk_,31,066,5,園長募集,principal,求人こだわり条件が園長募集です,kk_,32,067,5,主任募集,manager,求人こだわり条件が主任募集です,kk_,33,068,6,ママさん保育士多め,mom,園こだわり条件がママさん保育士多めです,ek_,1,069,6,男性スタッフ在籍,gentleman,園こだわり条件が男性スタッフ在籍です,ek_,2,070,6,アットホーム、小規模園,athome,園こだわり条件がアットホーム、小規模園です,ek_,3,071,6,駅チカ,ekichika,園こだわり条件が駅チカです,ek_,4,072,6,綺麗な職場,clean,園こだわり条件が綺麗な職場です,ek_,5,073,6,のびのび保育,nobinobi,園こだわり条件がのびのび保育です,ek_,6,074,6,園庭あり,garden,園こだわり条件が園庭ありです,ek_,7,075,6,モンテッソーリ教育,montessori,園こだわり条件がモンテッソーリ教育です,ek_,8,076,6,病後児保育,sick_child_care,園こだわり条件が病後児保育です,ek_,9,077,6,グローバル,global,園こだわり条件がグローバルです,ek_,10,078,6,家庭的保育,homey,園こだわり条件が家庭的保育です,ek_,11,079,6,産休育休復帰実績有,rejoin,園こだわり条件が産休育休復帰実績有です,ek_,12,080,6,有給消化率高,vacation,園こだわり条件が有給消化率高です,ek_,13,081,7,労災保険,accident,社会保険が労災保険です,in_,1,082,7,雇用保険,unemployment,社会保険が雇用保険です,in_,2,083,7,厚生年金,pension,社会保険が厚生年金です,in_,3,084,7,健康保険,health_insurance,社会保険が健康保険です,in_,4,085,8,オススメ求人,recommend,オススメフラグをつけた求人です,,1,0